{
  "game": {
    "title": "Pokémon Sword",
    "slug": "pokemon-sword",
    "code": "PSW",
    "targetPlatform": "Nintendo Switch",
    "mode": "genesis",
    "developer": "Game Freak",
    "publisher": "The Pokémon Company / Nintendo",
    "genre": "Monster Collecting RPG",
    "releaseYear": 2019,
    "estimatedDifficulty": 3,
    "estimatedHours": "25-35h main story, 50h+ for full base-game completion",
    "listVersion": "1.0",
    "rulesetVersion": "2.0",
    "status": "approved",
    "notes": "Genesis Mode. Nintendo Switch has no native achievement/trophy system, and Sword has never released on any other platform. Design decisions made at the research checkpoint: (1) Sword's version-exclusive Gym Leaders (Bea, 4th; Gordie, 6th) are deliberately NOT given individual trophies — they play an identical structural role to Shield's Allister/Melony, so a dedicated trophy would inflate the list without adding meaningful distinct content; they're covered by PSW-003 (first badge) and PSW-014 (all 8 badges), mirroring the Scarlet list's precedent of not trophying Great Tusk individually despite it being version-exclusive. (2) The Isle of Armor and Crown Tundra expansions each get a separate trophy list under `dlc` per Rule 14; neither affects this base Platinum, matching the precedent from the Scarlet list's Teal Mask/Indigo Disk lists. (3) PSW-026 (Pokémon Professor) targets only the base 400-species Galar Pokédex, deliberately completed before either DLC pack is installed (the Galar Dex does not expand from the DLC packs — they have their own separate dexes — but Zamazenta, the Shield-exclusive version legendary, and several other version-exclusive species still require trading with another player/copy to complete even the base dex; this is standard series behavior, not a design flaw). (4) Two scout sources disagreed on whether the Pokédex screen shows a numeric completion percentage on Switch; PSW-026 sidesteps this entirely by using the Shiny Charm — a discrete, unambiguous key item — as its verification target instead. (5) PSW-024 (Warrior of Legend)'s description deliberately avoids naming an exact catch location for Zacian, since sources disagreed on whether it's caught at Hammerlocke Stadium or the Slumbering Weald. (6) Battle Tower trophies (PSW-018, PSW-027) are phrased as one-time 'reach' milestones rather than 'maintain,' sidestepping a source disagreement over whether Battle Tower rank can regress after a loss. (7) Battle Stadium (online ranked/casual battles, requires paid Nintendo Switch Online) is deliberately excluded from this list per Rule 13 — Max Raid Battles and the Battle Tower are both confirmed fully soloable offline and are used instead. (8) The large batch of 2020-2022 time-limited Mystery Gift/serial-code event Pokémon (Shiny Zacian/Zamazenta, Zarude, Shiny Zeraora, etc.) is excluded entirely, not merely missable-flagged, since their distribution windows are almost certainly closed for a player starting today — the same reasoning the Scarlet list applied to its own expired event content. (9) List size and tier proportions (13 bronze / 8 silver / 6 gold / 1 platinum = 27+1) intentionally mirror the Scarlet list's structure, since both are similarly-scoped single-region mainline entries."
  },
  "trophies": [
    {
      "id": "PSW-001",
      "name": "Journey Begins",
      "description": "Leave Postwick with Hop and receive your starter Pokémon from Leon.",
      "tier": "bronze",
      "type": "story",
      "verification": "The opening sequence concludes with the starter Pokémon added to the party and the overworld map opening up beyond Postwick.",
      "missable": false,
      "secret": false,
      "origin": "original"
    },
    {
      "id": "PSW-002",
      "name": "Whispers in the Weald",
      "description": "Witness the Darkest Day manifest in the Slumbering Weald and find the Rusted Sword among its ruins.",
      "tier": "bronze",
      "type": "story",
      "verification": "The Darkest Day cutscene plays in the Slumbering Weald and the Rusted Sword is added to the Bag.",
      "missable": false,
      "secret": false,
      "origin": "original"
    },
    {
      "id": "PSW-003",
      "name": "First Badge",
      "description": "Defeat Milo, Turffield's Gym Leader, and earn your first Gym Badge.",
      "tier": "bronze",
      "type": "boss",
      "verification": "Milo's defeat cutscene plays and the Grass Badge is added to the Badge Case.",
      "missable": false,
      "secret": false,
      "origin": "original"
    },
    {
      "id": "PSW-004",
      "name": "Titan of the Ring",
      "description": "Dynamax a Pokémon in battle for the first time.",
      "tier": "bronze",
      "type": "mechanic",
      "verification": "The Dynamax growth animation plays and the giant Pokémon's Max Move options become available.",
      "missable": false,
      "secret": false,
      "origin": "original"
    },
    {
      "id": "PSW-005",
      "name": "Camp Cook",
      "description": "Set up camp and cook your first curry.",
      "tier": "bronze",
      "type": "mechanic",
      "verification": "The curry-cooking cutscene concludes and the meal is served to the party at camp.",
      "missable": false,
      "secret": false,
      "origin": "original"
    },
    {
      "id": "PSW-006",
      "name": "A Glimmer in Galar",
      "description": "Catch a Shiny Pokémon.",
      "tier": "bronze",
      "type": "collection",
      "verification": "The Shiny Pokémon is added to the party or box with its distinct color and sparkle animation.",
      "missable": false,
      "secret": false,
      "origin": "original"
    },
    {
      "id": "PSW-007",
      "name": "Back from the Past",
      "description": "Restore a Fossil Pokémon with Dr. Cara Liss on Route 6.",
      "tier": "bronze",
      "type": "collection",
      "verification": "The restored Fossil Pokémon is added to the party or box following Cara Liss's fusion process.",
      "missable": false,
      "secret": false,
      "origin": "original"
    },
    {
      "id": "PSW-008",
      "name": "Raid Victory",
      "description": "Clear a Max Raid Battle at a Pokémon Den in the Wild Area.",
      "tier": "bronze",
      "type": "challenge",
      "verification": "The raid's victory screen plays and its rewards are added to the Bag.",
      "missable": false,
      "secret": false,
      "origin": "original"
    },
    {
      "id": "PSW-009",
      "name": "Colossal Catch",
      "description": "Obtain your first Gigantamax Pokémon.",
      "tier": "bronze",
      "type": "collection",
      "verification": "The caught Pokémon's Pokédex/box entry displays its Gigantamax factor.",
      "missable": false,
      "secret": false,
      "origin": "original"
    },
    {
      "id": "PSW-010",
      "name": "Into the Wild Area",
      "description": "Enter the Wild Area for the first time.",
      "tier": "bronze",
      "type": "exploration",
      "verification": "The Wild Area loads and its overlay (weather, Dens, Watts display) appears on screen for the first time.",
      "missable": false,
      "secret": false,
      "origin": "original"
    },
    {
      "id": "PSW-011",
      "name": "Full Throttle",
      "description": "Complete a Rotom Rally run on the Rotom Bike.",
      "tier": "bronze",
      "type": "minigame",
      "verification": "The Rotom Rally course is finished before time expires and its reward is granted.",
      "missable": false,
      "secret": false,
      "origin": "original"
    },
    {
      "id": "PSW-012",
      "name": "A Fair Trade",
      "description": "Complete an in-game Pokémon trade with an NPC.",
      "tier": "bronze",
      "type": "sidequest",
      "verification": "The traded-for Pokémon appears in the party or box following the trade animation.",
      "missable": false,
      "secret": false,
      "origin": "original"
    },
    {
      "id": "PSW-013",
      "name": "Treasure Hunters",
      "description": "Pay the Digging Duo to dig for an item in the Wild Area for the first time.",
      "tier": "bronze",
      "type": "mechanic",
      "verification": "The dug-up item is added to the Bag following the digging animation.",
      "missable": false,
      "secret": false,
      "origin": "original"
    },
    {
      "id": "PSW-014",
      "name": "Champion's Circuit",
      "description": "Earn all 8 Gym Badges of the Galar League.",
      "tier": "silver",
      "type": "collection",
      "verification": "The Badge Case shows all 8 Gym Badges present.",
      "missable": false,
      "secret": false,
      "origin": "original"
    },
    {
      "id": "PSW-015",
      "name": "Star Student",
      "description": "Defeat Bede in his Champion Cup Finals gatecrasher battle.",
      "tier": "silver",
      "type": "boss",
      "verification": "Bede's defeat triggers his post-battle dialogue and the Champion Cup resumes toward the Championship match.",
      "missable": false,
      "secret": false,
      "origin": "original"
    },
    {
      "id": "PSW-016",
      "name": "Path to the Ruin",
      "description": "Defeat Chairman Rose at the Energy Plant.",
      "tier": "silver",
      "type": "boss",
      "verification": "Rose's defeat triggers his surrender and the story sequence continues toward the Energy Plant's core.",
      "missable": false,
      "secret": true,
      "origin": "original"
    },
    {
      "id": "PSW-017",
      "name": "Dex Explorer",
      "description": "Register at least 150 species in the Galar Pokédex.",
      "tier": "silver",
      "type": "collection",
      "verification": "The Pokédex app's registered-species count reaches 150 or higher.",
      "missable": false,
      "secret": false,
      "origin": "original"
    },
    {
      "id": "PSW-018",
      "name": "Great Ball and Beyond",
      "description": "Reach at least the Great Ball Tier in the postgame Battle Tower.",
      "tier": "silver",
      "type": "challenge",